<?xml version="1.0" encoding="UTF-8"?>
<tns:grading-hints xmlns:tns="urn:proforma:grades:v0.8"
                    xmlns:xsi="http://www.w3.org/2001/XMLSchema-instance"
                    xsi:schemaLocation="urn:proforma:grades:v0.8 ../proforma-grades.xsd">
    <tns:root function="sum">
        <tns:displaytitle>Total</tns:displaytitle>
        <tns:combine-ref weight="0.75" ref="basic"/>
        <tns:combine-ref weight="0.25" ref="advanced"/>
    </tns:root>
    <tns:combine id="basic" function="sum">
        <tns:displaytitle>Basic aspects</tns:displaytitle>
        <tns:test-ref weight="0.3" ref="test1">
            <tns:nullify-condition compare-op="lt">
                <tns:nullify-combine-ref ref="test2.max"/>
                <tns:nullify-literal value="0.5"/>
            </tns:nullify-condition>
        </tns:test-ref>
        <tns:test-ref weight="0.7" ref="test2" sub-ref="tc.a">
            <tns:displaytitle>Unit test, aspect A</tns:displaytitle>
        </tns:test-ref>
    </tns:combine>
    <tns:combine id="advanced" function="min">
        <tns:displaytitle>Advanced aspects</tns:displaytitle>
        <tns:test-ref ref="test2" sub-ref="tc.b">
            <tns:displaytitle>Unit test, aspect B</tns:displaytitle>
        </tns:test-ref>
        <tns:test-ref ref="test3"/>
        <tns:test-ref ref="test4"/>
    </tns:combine>
    <tns:combine id="test2.max" function="max">
        <tns:displaytitle>Best result of all unit test aspects</tns:displaytitle>
        <tns:test-ref ref="test2" sub-ref="tc.a"/>
        <tns:test-ref ref="test2" sub-ref="tc.b"/>
    </tns:combine>
</tns:grading-hints>
